{"schema_version":"coh.server-oidc/v1","contract_version":"1.0.0","profile_kind":"native_server","issuer":"https://identity.example.invalid/tenant-a","audiences":["coh-server"],"allowed_algorithms":["EdDSA","ES256","RS256"],"jwks_source_reference":"identity.primary","transport_security":"mtls","profile_decision_digest":"sha256:aaaaaaaaaaaaaaaaaaaaaaaaaaaaaaaaaaaaaaaaaaaaaaaaaaaaaaaaaaaaaaaa","maximum_token_age_seconds":300,"clock_skew_seconds":30}
